detokenize_text,sentimen
ikn lengkap transportasi massal bas listrik innalillahi sipepek clash champions tolol malmingan jogja jawa nonton,Positif
ambil makan wan abas nnti ikn kelar butuh jakarta,Positif
hut ikn innalillahi sipepek clash champions tolol malmingan jogja jawa nonton,Positif
percaya agustus raya jakarta ikn,Negatif
investasi ikn innalillahi sipepek clash champions tolol malmingan jogja jawa nonton,Positif
dampak banjir paku ikn ratus keluarga terima bantu dinsos kaltim,Negatif
pindah ikn bawa anak cucu kolega ikn lekas ramai,Positif
bela ikn kesana turun bandara,Positif
anggota pindah ikn kali dishub dki dkj tanyain dishub dkj,Positif
investor ngeri lihat ikn banjir bandang buruk jakarta,Negatif
nama ikn iki kota indonesia,Positif
allah isi kepala maksa bangun ikn,Negatif
kemaren tekor ngongkosin seleb ikn,Negatif
ikn sorry,Negatif
wes opo menneh kiiii gedung ikn candi rmh sakit kek panti jompo kek studio foto kek lainx serah bangun gedungx duit arti milik entr ramai waris dui,Negatif
jokowi nama catat presiden kantor ikn mah kaget,Negatif
kemarin sempet dengerin bentar elshinta influenser ikn ngakak pas denger alas milih diinfluence and are they even the right people,Negatif
ilangin polisi ikn,Negatif
ikn bangun banunan lai iya,Negatif
momen menteri pupr basuki minum air keran ikn momen menteripupr ikn airkeran,Positif
jujur rakyat dampak rakyat ikn perang gengsi jdi nuruti ego orang,Negatif
tanda eta seleb endorser ikn,Negatif
ikn bentuk bangun jalan jahat,Negatif
rakyat susah cari adil jdkn tumbal aparat hukum laku anak politis pkb aniaya,Negatif
gimana sejarah spill nama nusantara konteks gimana korelasi ikn,Positif
jalan ikn sepeda motor aktivitas kerja orang kantor swasta pns ikn sepi investor,Negatif
naahhh bikin klub bola basket lan mending ikn yah nusa bangsa,Positif
tuju biar bangun ikn,Positif
potret biar gambar ikn fakta lapang,Negatif
enak ikn tenang demo suara rakyat bikin ganggu fokus kerja rakyat mahasiswa ikn ongkos mahal,Negatif
cerewet mikirnya ikn tokoh bandung bondowoso bangun candi malam langsung cling,Negatif
presiden kantor ikn bawa influencer investor asn kantor aktivitas moga titik terang,Negatif
ikn bangun bangun ikn lha nama bangun sket,Positif
pns instansi ikn betah,Negatif
rakyat china bangga pinjam wilayah pribumi usir ikn doa gerombol cebong zalim jual aset bangsa,Negatif
plecidenmu nyantai ajojing ikn,Negatif
giat pagi purabaya unit wisata infone budal ikn,Positif
jokowi nungguin investasi dajjal masuk ikn gede,Negatif
bangun bangun bangga antero jagad raya lho moga ikn beda,Positif
ruang kerja kamar tidur presiden istana ikn,Positif
buang buang duit bangun ikn unfaedah sekolah sekolah rubuh kandang hewan,Negatif
top canggih taksi terbang ikn bikin penasaran bisnis,Positif
sampah doyanya ngehina orang sampah makasih promosiin ikn,Positif
dukung israel ganjar konsisten tolak israel sikap resmi negara cela ramai bau israel kecam habis habis ikn presiden ditet,Positif
whosh kcic made china framing influenser gagal tumpang bangkrut esemka ikn percaya,Negatif
ridwan kamil bln ikn macet jkt bual nyindir,Negatif
warta ajak kesana pilih sow liput sesuai sepakat masuk ambil gambar ijin otoritas ikn jdi sembarang liput gelar tiker tonton,Negatif
tuju indonesia pecah indonesia barat ibukota dki rakyat dukung anies indonesia timur ibukotanya ikn rakyat dukung prabowo,Negatif
sila sembah pindah ikn mudah moga betah,Negatif
asing uda nolak buka jatah pma klaster cepat oktober wajar pma kosong wajar kaum abah teriak ikn kosong,Positif
heboh presiden jokowi reshuffle kabinet ikn istana,Positif
era jokowi bangun sarana ekslusif jalan tol cepat plbn super megah bandara daerah cepat ikn singgung publik akibat daya beli tingkat konsumsi lemah,Negatif
ken ikn makan nya kepiting dandito balikpapan nginep nya pentacity hotel,Positif
bener ikn orang heran hewan,Negatif
kisah ikn oktober,Negatif
duit boss anggar resmi ikn trilyun bangun bukti investor bilang antri investor big bullshit,Negatif
bangun bangun kota daerah bangun bangun ikn,Negatif
dpr tanyain ngapain mukidi ngajak infuencer ikn manfaat neng makan serasa negara konoha tok,Negatif
prabowo ikn istana demit,Negatif
influncer bayar fasilitas positif ikn,Negatif
capexnya microsoft bikin ikn,Negatif
ikn pikir beliau indonesia ikn isi,Negatif
duh piknik say smua influencer artis biar kontenin kembang ikn gin orang kalimantan nikmat selesai ush repotkn tinggal nikmat pahammmmm,Negatif
duit rakyat tel ikn biarin sederhana mewah mah beres inget ikn jalan gagal sepi duit rakyat,Negatif
menhub bandara ikn darat pesawat raksasa desember,Negatif
hasil putus terobos ngantor ikn,Negatif
herkules kasih kantor ikn masbro,Negatif
boyong buzzerp influencerp ikn bentuk transparansi publik maksud menep anggap borok bangun ikn iknkotainfluencerp iknkotabuzzerp iknkotarelawan,Negatif
orang pindah ikn sehat,Negatif
sisi neng bahagia istana megah mewah ikn sisi rakyat tekan pajak listrik bbm tenaga kerja asing biy didik,Negatif
inti rakyat indonesia mayoritas ikn rakyat,Negatif
presiden ngajak geng motor jaya jaya jaya ikn motor tol sepenuh lihat keras ken ikn uda influencer lokal ajak kondi,Negatif
miris artis ikn enak makan uang rakyat,Negatif
ketua appbi mal jakarta potensi tumbuh ikn,Negatif
bawa puluh influencer alih promosi bagus ikn eeh nya ngadat imej jelek rugiii doong,Negatif
aplgi pindah ikn,Positif
sempet nya aki host bilang bawa kedaikopi blabla hati bilang mupeng ikn cengkunek pemred,Negatif
suruh influencer ikn boros makan rakyat,Negatif
paksa bangun ikn slama adil joko widodo basuki,Negatif
silah rakyat pindah ikn senang lihat,Negatif
rakyat sakit opname rumah sakit pulang,Negatif
ngkin pikir badut influencer bawa investor coba tawarin influencer bangun rumah ikn,Negatif
ikn nya influencer,Negatif
ormas agama islam persis kelola tambang masuk populer insentif pns ikn bisnisupdate update bisnis text,Negatif
papa ngantor ikn buka biro jasa urus stnk,Negatif
konsep kota kagak paham mikirin bgtuan ikn bangun istana presiden investor cicil bikin gantung investor kampret,Negatif
proses batas loi letter intent kuat hukum tanam uang biaya bangun ikn investor tanda tangan loi sah,Negatif
orang orang pindah ikn,Negatif
pilih paksa ngantor ikn terpaka pilih,Negatif
habis kero diare air ikn ecolinya,Negatif
ngelesnya gin kemarin kemarin klaim insvestor investasi ikn,Negatif
jokowinya uda bilang presiden tinggal ikn mulih kampung,Negatif
sulit hidup rakyat tonton kehingar bingaran selebritas ikn shame you,Negatif
biang jahat tipu janji palsu tukang hutang bayar hutang rampok hutan tambang rampok hak rakyat koruptor kolusi nepotisme politis jahat penghianat bangsa kumpul ikn pulau,Negatif
atur pakai hadir kelompok buzzerp,Negatif
pingin daftar ikn biaya nyata apbn doa rakyat laknat klrganya ajak azab pedih munafi,Negatif
silah cek harga aqua balikpapan galon antri ikn gin,Negatif
gpp presiden priode presiden ikn presiden rep indonesia wkwkwkwkkwk,Negatif
ikn selesai manfaat rakyat,Negatif
pesan rakyat bohong influzer tinggal ikn nya situ waw enak kota waw,Negatif
ngoceh framing hantem ikn enak make narsum bilang,Negatif
pagi baca berita ikn bikin mikir pola gimana survive,Negatif
ikn keren orang gebleg panas,Negatif
takut ngutang bank dunia paksa minjam uang rakyat modus asuransi anggar ikn,Negatif
jokowi kantor perdana ikn air limpah internet bagus,Positif
ikn mangkrak ikn air listrik jkw nganto,Negatif
jokowi ngantor ikn,Positif
maksud naekin citra positif ngajak influenser ikn wait,Negatif
prestasi bangsa ikn prestasi bidang,Positif
moga ikn gate bongkar lengser,Negatif
kerja halang ikn dibiarin mangkrak otomatis program prabowo tegak lurus jokowi doan,Negatif
lihat isi kamar tidur presiden jokowi ikn lengkap meja kerja,Positif
enapa tokoh adat kalimantan undang megah nikmat ikn artis ajak kesana,Negatif
beliau nyenak tidur mikirin sisa jabat bln project ikn target kuatir candi hambalang mesti dukung,Negatif
nguawuuurrr wartawan masuk ikn data bikin berita aneh pulang dijatuhin pesawat,Negatif
ikn the one and only konten kontroversial rame wkwk,Negatif
daftar nama artis cebong kota ngayal ikn,Negatif
ngalah pindah ikn,Negatif
usul masuk akal efektif buka jalan investor masuk ikn,Positif
paksa ridwan kamil ikn bln bln cela mencle,Negatif
patut neng bogor dingin lurah tinggal ikn semlm panas,Negatif
nama orang opini bang pro kontra lagipula kritik muncul salah ikn sesuai narasi,Negatif
mutasi ikn,Positif
kayak artis undang ikn jiwa jilat hehe,Negatif
tinggal ikn gmana auuwhh,Negatif
kepala jokowi biar pas lengser leges biar kenang presiden sukses eksekusi bangun ikn dtg jkt modal esemka,Negatif
berani ngomong jelek ikn please deh bro cerdas dikit,Negatif
ngantor ikn kaya piknik,Negatif
jokowi kantor ikn piknik artis hny citra,Negatif
rencana niga ikn nyaman,Negatif
binatu manja makan malam ikn,Positif
jokowi nginap malam ikn pki said didu kejang kejang hahahaha,Negatif
pasien orang hutan wkwkwk investor ngantri ikn,Negatif
lunas janji bln kantor ikn,Positif
top comment suka jokowi,Positif
ikn kaltim mandiri pangan saran kadin kadin provinsi kalimantan timur tawar ribu hektare lahan sawah kabupaten najam paser utara ppu dukung program tahan pangan ikn,Negatif
pindahin ikn biar kakap kelahi kakap teri,Positif
motor masuk tol tol motor tol ikn tinggal atur biar motor motor kawasan inti ikn tol kawasan inti ikn pas masuk kawasan inti jalan kaki,Positif
menteri pupr basuki hadimuljono jalan tol ikn fungsi lancar gera tamu upacara agustus ikn nusantara ibukotanegaranusantara iknnusantara indonesiaemas iknkotamodern ikn indonesiamaju,Positif
menteri pupr basuki hadimuljono jalan tol ikn fungsi lancar gera tamu upacara agustus ikn nusantara ibukotanegaranusantara iknnusantara indonesiaemas iknkotamodern ikn indonesiamaju,Negatif
mulyono hantu ikn,Positif
desain arsitektur intip konsep vertikal ikn,Negatif
diem mah anggar ikn ban dukung onoh uang investor,Negatif
wes macem nyekel proyek ikn,Negatif
bangun ikn,Positif
mas mulyono kel ikn,Negatif
cek fakta gempa megathrust takut warga pindah ikn,Negatif
ikn gimanaaa woeee ikn ikn sanaaaa,Negatif
triliun sebenernya bangun kota kalimantan perata sekolah sehat bangun ikn warga asli masuk kuota batas khusus,Negatif
koq ikn,Negatif
junjung mulyono bansos bikin kereta cepat ikn rugi negara,Negatif
miniatur ikn garuda mending simetris,Negatif
disclaimer masyarakat sehat jaman cucun jarang dengerin eps ramadhan thn ide perintah mbak maksud bang pandji miliar,Negatif
ayo bawa keluarga harta unggas penuh bahtera ikn,Negatif
gin selesai perintah bangun ikn dipaksain selesai pokok anjing bilang urus bla blaa,Negatif
nguawuuurrr wartawan masuk ikn data bikin berita aneh pulang dijatuhin pesawat,Negatif
transmigrasi ikn biar cepet ramai contoh bgi warga pindah ikn solo padat jkt duduk luber,Positif
milih ikn nder,Negatif
ikn bohong ijazah bohong wawancara bohong ekonomi roket bohong bohong suka bohong dunia visi misi masuk kapal mukidi kelak dajal bangkit orang orang iman,Negatif
duit digelontorin ikn bansos biar milih samsul,Negatif
deket pajak naek hak masyarakat adat milik tanah ikn,Negatif
pks tolak ikn bertanggungjawab janji alas bohong,Negatif
takut tular virus php bual emul omong bln ikn macet jakarta,Negatif
lik sampak aampak ikn blok,Negatif
pas salah sudut ikn foto foto,Negatif
mulyono kerja kerja kerja bayar ikn,Negatif
kemaren bilang ikn tara jkt ngibul,Negatif
kota nusantara ikn kesiap pln sedia listrik bersih andal kesiap personel dukung upacara hut ikn lengkap marketplaceplnmobile greeneconomypln plnelectricrun,Positif
kota nusantara ikn kesiap pln sedia listrik bersih andal kesiap personel dukung upacara hut ikn lengkap marketplaceplnmobile greeneconomypln plnelectricrun,Positif
taiii ajak ikn males ijin kuliah taiii kemaren ijin ngerti,Negatif
kota nusantara ikn kesiap pln sedia listrik bersih andal kesiap personel dukung upacara hut ikn lengkap plnsukseskanupacaraikn plnsukseskanikn pvrooftopplnmobile,Positif
ikn kalteng ajar congor mangap,Negatif
buang uang hasil keringat rakyat ikn nya penuh janji cipta lapang kerja,Negatif
duit ikn ngos ngosan,Negatif
pln all out dukung lancar merdeka listrik andal persen sumber energi hijau kota nusantara ikn sabtu lengkap greeneconomypln plnelectricrun,Positif
pikir pandemi tes pcr tanggung perintah tes juta dompet kelar covid bikin ikn,Negatif
berita mending elu ikn wartawan oneng,Negatif
sabtu agustus indonesia emas ikn bumn jakarta dpr reformasi selesai shp merah putih stamps postoffice philately ebay nft art propertyinvestment marketingagency reformasi asembagus situbondo tapal kuda jawa timur malang semarang,Positif
pln all out dukung lancar merdeka listrik andal persen sumber energi hijau kota nusantara ikn sabtu lengkap greeneconomypln plnelectricrun,Positif
keren pusat belanja ikn ken mampir,Positif
pln all out dukung lancar merdeka listrik andal persen sumber energi hijau kota nusantara ikn sabtu lengkap greeneconomypln plnelectricrun,Positif
pdip bagus usung pramono anung tingkah laku mulyono shg berani cawe pilkada dki orang jakarta pilih orang orang ikn arti banding dki,Negatif
lol jalan sumut mah mending bangun ikn wkwkwkwk,Negatif
cancel ikn,Negatif
kemarin agustus ikn nyewa mobil unit bisaaaaa,Negatif
piye wajah ikn gurem ubah jakarta,Negatif
ontolohot suruh ikn dasar barakokok,Negatif
proses ikn butuh jalan,Positif
ikn bangga indonesia langsung pesimis,Positif
proyek ikn instan hasil maju,Positif
ikn proyek tantang langsung pesimis,Positif
langkah ros biar ikn selesai sesuai target sabar,Positif
ikn investasi jangka negara,Positif
ros cari investor bukti serius perintah nyelesain ikn,Positif
ikn dikerjain,Positif
alas dikerjain biar ikn,Positif
proses ikn instan progress nya,Positif
ikn investasi tantang manfaat,Positif
etika gimana kampanye anti ikn makan siang gratis terima maslahat gabung gibran,Negatif
ikn proyek main main wajar butuh,Positif
ikn proyek gagal nyata,Negatif
jokowi alas tunda ikn hasil,Negatif
proyek mangkrak ikn fokus,Negatif
ikn ikn kerja rakyat,Negatif
jokowi alas ikn rakyat peduli,Negatif
jokowi tunda ikn mending fokus rakyat,Negatif
proyek ikn buang buang uang,Negatif
ikn bikin rakyat percaya janji janji perintah,Negatif
bosen dengerin jokowi alas ikn urus rakyat,Negatif
ikn angan angan percaya proyek selesai,Negatif
ikn selesai mending jokowi fokus ekonomi rakyat,Negatif
jokowi alas ikn butuh rakyat kerja,Negatif
ikn proyek habis duit negara,Negatif
ngapain buang uang ikn rakyat butuh hidup layak,Negatif
ikn ikn bosan rakyat butuh solusi nyata,Negatif
buang ikn mending fokus rakyat butuh kerja,Negatif
jokowi tunda pindah ikn proyek hati,Negatif
ros cari investor iya ikn beneran ragu deh,Negatif
ikn pusat tumbuh pajak bayar manfaat,Negatif
ikn motor gerak ekonomi langkah strategis indonesia,Negatif
ikn distribusi bangun indonesia lihat jangka pendek,Negatif
bangun ikn pribadi,Negatif
ros jalan jalan bawa investasi cepat ikn langkah konkret,Negatif
ikn kota investasi sejahtera ambisi,Positif
investor asing bantu cepat bangun ikn langkah strategis mimpi,Positif
ikn legacy indonesia proyek,Positif
repost atrbpn halo sobatrbpn dukung bangun kota nusantara ikn menteri atr bpn paket tanah infrastruktur ikn,Positif
investor asing ikn apbn pakai proyek nasional proyek,Positif
proyek ikn jangka bangsa proyek,Positif
bandara ikn jokowi tunda pindah proyek gagal,Negatif
proyek ikn bikin rakyat derita pajak manfaat,Negatif
ikn naikin gengsi jokowi rakyat buang duit,Negatif
perintah pandai janji bandara ikn kelar malu maluin,Negatif
jokowi tunda pindah ikn proyek sukses,Negatif
ikn proyek mercusuar bikin rakyat miskin,Negatif
bandara ikn ngomong investor,Negatif
proyek ikn buang duit rakyat pribadi jokowi rakyat untung,Negatif
ros singapura jalan jalan cari solusi ikn,Negatif
ikn proyek ambisi manfaat rakyat buang buang duit,Negatif
perintah bohong kesiap ikn bukti beneran,Negatif
ikn proyek jokowi beban presiden,Negatif
ikn proyek ambisius manfaat rakyat suruh bayar pajak,Negatif
bangun ikn mending fokus selesai rakyat desak,Negatif
perintah area parkir guide warga kunjung ikn selamat ikn smartcity wisataikn,Positif
parkir guide warga kunjung ikn ikn smartcity wisataikn,Positif
sasar anjing rumah menteri noh ikn sasar,Negatif
langkah cepat ros tarik investasi asing wujud nyata komitmen perintah hadap ikn,Positif
kunjung ros singapura langkah proaktif ikn,Positif
ros gerak cepat investor asing tarik ikn,Positif
langkah cepat ros singapura strategis lancar proyek ikn,Positif
ros roeslani inisiatif cari investor asing ikn,Positif
ros langsung action investor ikn beres,Positif
langkah ros point ikn maju,Positif
ros gerak cepat investor singapura bantu wujud ikn,Positif
ikn canggih ros siapin investor singapura,Positif
ros nunggu investor ikn tangan,Positif
investor singapura bantu ikn mantap berkat ros,Positif
langsung tancap gas ikn cepat wujud investor asing,Positif
gercep ros investor tangan ikn,Positif
ros bawa kabar singapura ikn maju,Positif
ikn kota investor singapura fix,Positif
ros langsung gaspol singapura ikn investor bantu,Positif
ros siapin jalan ikn investor singapura bantu,Positif
langkah ros singapura rupa putus strategis ikn,Positif
ros dedikasi komitmen dukung proyek ikn,Positif
investasi asing upaya ros esensial cepat bangun ikn,Positif
ros roeslani ambil tindak lancar bangun ikn,Positif
langkah cepat ros singapura contoh nyata proaktif perintah wujud ikn,Positif
ibukota jakarta ikn legal,Negatif
smart city pindah ikn ogah,Negatif
kesana bacot mending loe bikin jadiin anies ketua,Negatif
rakyat neng bagusin kota bikin kota kemarin capres ide gaung ikn goblok mul,Negatif
dunia fta benua orang pikir sinpanse jokowi jokowi nanggis lho naga rakyat benci bilang ikn rakyat mabuk,Negatif
pindah tanggal teriak pindah ikn kerja time line nya kelas presiden mencla mencle,Negatif
alhamdulillah investor asing banjir modal ikn moga bangun jalan pesat sumber negara tuju indonesia emas,Positif
iya arti ikn ibukota negara,Negatif
lantik jakarta dpr mpr jakarta ikn kaya jokowi walo ijasah palsu presiden,Negatif
bus khusus biar masuk ikn kendara pribadi parkir rest area toilet bayar air kuning becek campur lumpur jarak kawasan video,Negatif
ikn mangkrak,Negatif
dikomentarin ikn sesuai target kkn dana haji blunderin,Negatif
ekonomi sulit bangun ikn,Negatif
jokowi kuat data pindah ikn cepat pindah rumah ribet pindah ibukota triliun kantong ambil hutang triliun,Negatif
rakyat dukung proyek ikn saksi lawan yaumil,Negatif
ikn mangkrak fufufafaaibnasional fufufafaaibnasional keluarga bawa sial negara indonesia,Negatif
informasi investor asing kuncurkan dana ikn omong omong kaya,Negatif
bener nebeng gampang berkat ikn hemat tenaga,Positif
makan ikn waras kau lol,Negatif
timnas latih ikn piala asia,Positif
ikn biaya masuk bro ira ikn objek wisata candi,Negatif
masuk kota bayar glorifikasi ikn buah kota area wisata cerita jabat arti harfiah masuk tinggal jabat nolak,Negatif
akumulasi marah publik ikn potensi mangkrak,Negatif
miliar mah upil korupsi triliun bangun ikn nyisa,Negatif
mulyono pindah ikn bawa influencer nya sumpek dimarih,Negatif
duit negara fokus ikn,Negatif
coba cari ikn males patung garuda,Negatif
gilir bau bau mangkrak mata bilang putus rakyat indonesia rakyat indonesia ngurus ikn rakyat butuh ikn tai rakyat butuh sembako murah upah layak lapang,Negatif
ikn pas kubur legacy mulyono,Negatif
blusukan janji tuntas langgar ham janji utang gunung revolusi mental langgar etik langgar hukum gagal ganti infrastruktur ikn kknepotisme nya bangga jilat,Negatif
bangun gaya ikn orang kesana orang tugas,Negatif
tuju ama ikn anjing,Negatif
jokowi kecut pulak ragu keppres ikn,Negatif
fufufafa suruh tinggal ikn ogah jelek fasilitas jakarta bagus fasilitas lengkap,Negatif
sim lemah paspor lemah hukum karet orang negeri invest indo ekonomi anjlok mulyono ngutang terosss bansos impor beras bangun ikn cape warga indo pajak nya ros dipajakin,Negatif
jok slrh rkyt sebenernya ikn lahir ambisi loe,Negatif
tinggal nunggu sekolah wajib karyawisata ikn,Negatif
kota ikn spesifik won,Negatif
syarat ngilang edar kasih deodorant biar bau ketek ikn ikat keluarga nebeng mulyono nebeng fufufafaaibnasional nebeng paman,Negatif
min ikn aman kontruksi batas negara libanon tanam bom intelegen israel,Negatif
serius nanya murah bangun ikn jembatan pulau pulau,Negatif
ikn program kampanye jokowi habis dana super tnpa kaji dlu elu heboh gilir janji politik jokowi kampanye ditepatin elu diem akal sehat,Negatif
buzzer goblog bikin ikn pake duit rakyat kesana bayar,Negatif
percaya ikn bangun rakyat percaya broo,Negatif
gimana ampas aset hakekat jadiin barang becandaan bentar ikn masuk daftar situs mangkrak dunia,Negatif
ngantor ikn,Negatif
awas kena prank ikn sulap jakarta singkat sayang omong,Negatif
jokowi ngantor ikn,Negatif
mulyono bilang duit triliun puyeng nyari dana ikn cma triliun ngambil apbn triliun dukung mulyono pikir kesitu mulyono tukang bohong,Negatif
orang arogan jakarta laku jga ikn,Negatif
mulyono ngantor ikn,Negatif
lengser pikir negara capital city ibukota negara nasib ikn proyek bpk mangkrak capital city dki jakarta mohon laksana terima kasih,Negatif
rakyat ikn orang rakyat tuju dengar rakyat cebong,Negatif
pantes ikn hitam,Negatif
bayang pindah kota undang undang fisik aneh bin ajaib reflyharun ikn kota negara,Negatif
ngakak emoji ikn nonton emyu wkwkwkw,Negatif
genuinely asking deh hak terima predikat warga lokal nya ikn seinget diciptain pindah asn mayoritas wrga kalimantan klaim lokal nya,Negatif
bikin heran knapa bela ikn rakyat indonesia wacana proses ruu nalar sah segi formal administratif materi substatif prinsip atur undang,Negatif
that tetangga tho genuinely asking deh hak terima predikat warga lokal nya ikn seinget diciptain pindah asn mayoritas wrga kalimantan klaim lokal nya,Negatif
ikn pas kubur legacy mulyono,Negatif
susah ngeyel bilang sayang orang ikn mempan,Negatif
ikn habis triliun mending pakai beli emyu taiii,Negatif
dungu ikn hebat,Negatif
nyata mangkrak mulyono bahas ikn bodoh piara,Negatif
daerah sangga sdm aviasi optimal peluang bandara vvip ikn,Positif
ikn langkah nyata wujud maju indonesia,Positif
ibukotanya hilang tinggal dkj jakarta ngapain buang ibukota biar ikn terbit dkj,Negatif
compair ajig skil nya ikn doi kabupaten sesuai outfitnya doi skena kabupaten hahaha,Negatif
ugm nus kolaborasi sukses proyek ikn kota modern,Positif
ikn bangun pusat ekonomi indonesia,Positif
dampak ekonomis masyarakat ikn ikn pusat perintah pusat bisnis,Negatif
ato kampus pindah ikn kali,Negatif
ikn tuan rumah ktt air asia pasifik,Positif
otorita ikn imbau warga cegah sebar demam darah dengue,Positif
bangun mba plan sabar komen deh ojo kesusu,Negatif
tanda ikn mangkrak,Negatif
kemarin aki didu bilang bangke gajah ikn liat vidio kejang aki didu,Negatif
ikn bacot,Negatif
ikn gedong biskup,Negatif
gotong ikn,Negatif
perintah prioritas bangun istana ikn banding benah sektor fakta bilang investor asing nyata asing males investasi ikn seka,Negatif
ikn kayak,Negatif
ikn apakabar,Negatif
tukang sapu ikn,Negatif
saran bangun ikn bikin rusun ani,Negatif
hormat presiden joko widodo platform wni ijin usul patung yuri gagarin pasang mataram kebayoran jakarta mohon patung pindah ikn terima kasih takzim,Negatif
investor putar duit orang batas daerah situ,Negatif
ngotot ikn dulling negara,Negatif
suruh jokowi keppres ikn kota selesai keppres lantik presiden jakarta potensi sah,Negatif
ngajak makan makan ikn ajak influenza artis menteri menteri ambang gagal ajak sedia,Negatif
ketawa ikn,Negatif
tuju ikn,Negatif
temen usaha catering kerja bangun jalan semboyan tiada ngecor,Positif
maksud dukung rakyat ikn tuju dpr undang undang maksud rakyat situ dpr orang rakyat indonesia dimintain tuju lebaran kuda,Negatif
percaya bangun ikn jalan mangkrak investor lokal asing masuk kerja proyek anggar ikn milyar moga info salah ngebut,Positif
daftarin mertua kunjung kesana aplikasi rencana bayar gatau pas kemarin daftarin muncul gituuu kode voucher gatau,Positif
hutang negara prestasi bayar pajak beban masyarakat hukum indonesia ambu adur prestasi ikn mngkrak prestasi mlah nyalahin rakyat,Negatif
dijadiin jurassic park resort,Negatif
champions ikn,Positif
bang kelak lantik prabowo kantor ikn gimana jokowi kantor,Positif
bisnis cuci uang kaya ikn paham,Negatif
malu jokowawa ikn,Negatif
orang gila simbol resmi serah piala jalan catwalk ikn dadah show off sederhana apayah gaya politik bangke tebar pesona,Negatif
izin prof provinsi daerah khusus ibukota jakarta maksud pasal ikn dkj pasal provinsi masuk batas batas wilayah daera,Positif
presiden jokowi bangun ikn nusantara transformasi tuju indonesia maju ikn nusantara bangsa indonesia cermin identitas nasional indentitas nampak kemudi,Positif
ikn ibukota hak dapet anggar kepala otorita hak dapet anggar kota resmi aneh bener ikn dkj,Negatif
izin prof provinsi daerah khusus ibukota jakarta maksud pasal ikn dkj pasal provinsi masuk batas batas wilayah daerah khusus jakarta,Negatif
proyek mulyono harga samsek postingan gin captionnya bangett sok asik jatuh ngedown grade nilai,Negatif
ikn nusantara ibukota hak dapet anggar kepala otorita aneh undang ikn dkj,Negatif
ikn ikentot,Negatif
provinsi daerah khusus ibukota jakarta maksud pasal ikn dkj pasal provinsi masuk batas batas wilayah daerah khusus jakarta undang undang,Negatif
usogi suka kak ikn takut ketemu oknum titttt sensor nyaman warga,Negatif
jarene ngantor nang ikn ancen paten lambene,Negatif
ikn mangkrak,Negatif
dis urus kerja kurikulum smk guru olah output didik orang layak roda gigi industri negara ngurusin mending ngurus ikn makan siang gratis buruh bodoh idam negara,Negatif
woii mulyono sadar kuasa lengser ngomong rakyat ikn rakyat indonesia paham ikn ambisi nya siapah adilijokowi,Negatif
ikn garuda,Negatif
ibukota pindah tahap bikin undang undang keblinger habis minum khamr ikn insya allah tuhan maha,Negatif
mudah bangun ikn luas nya jakarta maksimal jakarta fokus fungsi ibukota anggar maksimal triliun,Positif
ape singgasana ikn cabang jepang,Negatif
