full_text,sentimen,detokenize_text
@Puspen_TNI Min apakah ikn aman dari kontruksi seperti batas negara Libanon yg telah di tanam bom oleh intelegen Israel???,Negatif,min ikn aman kontruksi batas negara libanon tanam bom intelegen israel
Serius nanya murahan bangun IKN atau jembatan antar pulau-pulau besar?,Negatif,serius nanya murah bangun ikn jembatan pulau pulau
@mas_veel IKN bukan program kampanye jokowi dan menghabiskan dana super banyak dg tnpa ada kajian dlu elu heboh... Giliran janji2 politik jokowi waktu kampanye banyak gak ditepatin elu diem... Akal sehatmu dimana?,Negatif,ikn program kampanye jokowi habis dana super tnpa kaji dlu elu heboh gilir janji politik jokowi kampanye ditepatin elu diem akal sehat
@tham878 buzzer goblog bikin ikn jg pake duit rakyat masa kesana harus bayar,Negatif,buzzer goblog bikin ikn pake duit rakyat kesana bayar
@ganjarpranowo @masbutet Siapa yg percaya IKN bisa dibangun selama 5 Tahun ? Semua Rakyat percaya broo kecuali yg 16%.,Negatif,percaya ikn bangun rakyat percaya broo
@VIVAcoid Gimana mau minta UU Perampasan Aset kalau hakekat UU itu lu jadiin barang becandaan? Bentar lagi IKN masuk daftar sbg situs mangkrak terbesar dunia.....,Negatif,gimana ampas aset hakekat jadiin barang becandaan bentar ikn masuk daftar situs mangkrak dunia
@jokowi Kapan ngantor di IKN?? https://t.co/8lEeSw4fML,Negatif,ngantor ikn
@denismalhotra Awas kena prank lagi ingat ikn aja bisa disulap seperti Jakarta dlm waktu singkat. sayangnya cuma omon2,Negatif,awas kena prank ikn sulap jakarta singkat sayang omong
@ferrykoto Jadi kapan JOKOWI @jokowi ngantor di IKN??...Bisa jawab?? https://t.co/elVpoRlSkj,Negatif,jokowi ngantor ikn
@tham878 Mulyono bilang punya duit 11.000 T kok puyeng amat nyari dana buat IKN yg cma 400T bahkan udh ngambil apbn pula 100T... Kamu selaku pendukung mulyono emang gak punya pikiran kesitu atau kamu tau si mulyono itu tukang bohong?,Negatif,mulyono bilang duit triliun puyeng nyari dana ikn cma triliun ngambil apbn triliun dukung mulyono pikir kesitu mulyono tukang bohong
@anaksaayana Jika org luar arogan di jakarta berlaku jga di IKN,Negatif,orang arogan jakarta laku jga ikn
@EricRicaldo Jadi MULYONO sudah ngantor di IKN belum??!! https://t.co/ClrQQlW1Fy,Negatif,mulyono ngantor ikn
@jokowi Pak sebelum lengser Pikirkan Negara ini yg tanpa Capital City/Ibukota Negara. Klo nasib IKN masih belum jelas dan bakal jadi proyek Bpk yang mangkrak maka kembalikanlah Capital City ke DKI Jakarta lagi. Mohon di laksanakan segera Pak Terima Kasih.,Negatif,lengser pikir negara capital city ibukota negara nasib ikn proyek bpk mangkrak capital city dki jakarta mohon laksana terima kasih
Rakyat yg mana yg mau ikn wong semua rakyat TDK setuju malah TDK di dengarkan.Mungkin rakyatnya cebong semua .,Negatif,rakyat ikn orang rakyat tuju dengar rakyat cebong
@DokterTifa Pantes di IKN hitam,Negatif,pantes ikn hitam
Bayangkan kok bisa memindahkan ibu kota dgn undang-undang tapi fisiknya aja baru mau dimulai??! Kan aneh bin ajaib! #ReflyHarun #IKN Jadi Ibu Kota Negara kita sekarang dimana ? https://t.co/g6wqgkOeos,Negatif,bayang pindah kota undang undang fisik aneh bin ajaib reflyharun ikn kota negara
@Praz_Teguh Ngakak emoji IKN gua nonton emyu. Wkwkwkw https://t.co/y3pUaMBJmz,Negatif,ngakak emoji ikn nonton emyu wkwkwkw
@stravenues Genuinely asking deh emg yg bakal disebut dan berhak menerima predikat warga lokal nya ikn tuh siapa sih? Soalnya seinget gue diciptain buat pemindahan ASN yg jelas mayoritas bukan wrga kalimantan. Nah jd nanti klaim lokal nya itu akan buat si,Negatif,genuinely asking deh hak terima predikat warga lokal nya ikn seinget diciptain pindah asn mayoritas wrga kalimantan klaim lokal nya
Yg bikin heran knapa masih saja banyak yg membela bahwa IKN itu keinginan Seluruh Rakyat Indonesia. Dr wacana awal hingga proses RUU pun sudah di luar nalar. UU tersebut hanya sah dr segi formal administratif tp jauh dr materi substatif prinsip pembuatan peraturan perundang2an.,Negatif,bikin heran knapa bela ikn rakyat indonesia wacana proses ruu nalar sah segi formal administratif materi substatif prinsip atur undang
@tham878 That tetangga tho genuinely asking deh emg yg bakal disebut dan berhak menerima predikat warga lokal nya ikn tuh siapa sih? Soalnya seinget gue diciptain buat pemindahan ASN yg jelas mayoritas bukan wrga kalimantan. Nah jd nanti klaim lokal nya i,Negatif,that tetangga tho genuinely asking deh hak terima predikat warga lokal nya ikn seinget diciptain pindah asn mayoritas wrga kalimantan klaim lokal nya
IKN Tempat Yang Pas Untuk Mengubur Seluruh Legacy Mulyono https://t.co/aq2gI2vafF,Negatif,ikn pas kubur legacy mulyono
@sbyfess Susah sih kalo kamu masih ngeyel bilang sayang. diyakinkan sama orang 1 ikn juga ga bakal mempan,Negatif,susah ngeyel bilang sayang orang ikn mempan
IKN udah ngabisin 72t mending dipake buat beli emyu dah taiii.,Negatif,ikn habis triliun mending pakai beli emyu taiii
@DedynurPalakka Dungu.. Ikn hebat dari apanya???,Negatif,dungu ikn hebat
@tham878 Udah dinyatakan mangkrak sama mulyono lu masih bahas ikn aja..bego dipiara,Negatif,nyata mangkrak mulyono bahas ikn bodoh piara
Daerah Penyangga Siapkan SDM Aviasi untuk Optimalkan Peluang di Bandara VVIP IKN https://t.co/mXYWEBPZz9,Positif,daerah sangga sdm aviasi optimal peluang bandara vvip ikn
IKN Langkah Nyata Wujudkan Kemajuan Indonesia https://t.co/g3Q5mtGAW9,Positif,ikn langkah nyata wujud maju indonesia
@Lembayung071 Ibukotanya udah hilang! Tinggal DKJ! Kalau masih di Jakarta ngapain juga buang Ibukota? Biarkan aja dulu sampai IKN jadi baru menerbitkan UU DKJ!,Negatif,ibukotanya hilang tinggal dkj jakarta ngapain buang ibukota biar ikn terbit dkj
Kalau di compair jauh ajig skil nya ibarat gua di IKN doi masih di kabupaten sesuai tuh sama outfitnya doi skena kabupaten hahaha,Negatif,compair ajig skil nya ikn doi kabupaten sesuai outfitnya doi skena kabupaten hahaha
UGM dan NUS Siap Kolaborasi Sukseskan Proyek IKN sebagai Kota Modern dan Berkelanjutan https://t.co/m5uyd7RFq4,Positif,ugm nus kolaborasi sukses proyek ikn kota modern
IKN Dibangun Untuk Menjadi Pusat Ekonomi Baru Indonesia https://t.co/OeoAgV4k64,Positif,ikn bangun pusat ekonomi indonesia
@DedynurPalakka Dampak EKONOMIS buat masyarakat dengan adanya IKN itu apa sih? IKN itu Pusat Pemerintahan atau Pusat Bisnis sih???,Negatif,dampak ekonomis masyarakat ikn ikn pusat perintah pusat bisnis
@islah_bahrawi Ato mungkin kampusnya udah pindah di ikn kali ya kok g ada,Negatif,ato kampus pindah ikn kali
IKN Bakal Jadi Tuan Rumah KTT Air Asia Pasifik ke-5 di 2027 https://t.co/1vbYi79qm3,Positif,ikn tuan rumah ktt air asia pasifik
Otorita IKN Imbau Warga Cegah Penyebaran Demam Berdarah Dengue https://t.co/gHyOLTWk26,Positif,otorita ikn imbau warga cegah sebar demam darah dengue
@elisa_jkt @ikn_id Masih pembangunan mba dari plan 10-15tahun Sabar nanti komen lagi 10-15tahun kedepan klo masih sama baru deh. Ojo kesusu,Negatif,bangun mba plan sabar komen deh ojo kesusu
@tempodotco Pertanda IKN akan Mangkrak,Negatif,tanda ikn mangkrak
Kemarin si aki didu bilang ada bangke gajah di IKN. Liat vidio ini jgn kejang2 ya aki didu.,Negatif,kemarin aki didu bilang bangke gajah ikn liat vidio kejang aki didu
@Andria75777 Makanya ke IKN dulu baru bacot,Negatif,ikn bacot
@KompasTV IKN kok jadi KAYAK GEDONG BISKUP,Negatif,ikn gedong biskup
@verydoki gotong ke ikn aja,Negatif,gotong ikn
@NordickVv @Sunyisejati @bagussunarto25 @sandiuno @jokowi pemerintah memprioritaskan bangun istana ga penting IKN dibanding membenahi sektor yg lain adalah FAKTA bilangnya ada investor asing kenyataannya?? bahkan asing aja males investasi di IKN tapi seka,Negatif,perintah prioritas bangun istana ikn banding benah sektor fakta bilang investor asing nyata asing males investasi ikn seka
@vvotanet IKN kayaknya,Negatif,ikn kayak
@jokowi IKN apakabar?,Negatif,ikn apakabar
@temanduit Anda tepat jadi tukang sapu IKN,Negatif,tukang sapu ikn
saran @andradeza untuk pembangunan ikn: bikin rusun untuk ani2,Negatif,saran bangun ikn bikin rusun ani
Yang kami hormati Pak Presiden Joko Widodo @jokowi. Melalui platform ini kami sebagai wni ijin usulkan agar Patung Yuri Gagarin yg terpasang di Jl Mataram Kebayoran Jakarta sejak 2021 mohon patung tersebut dapat dipindahkan ke IKN. Terima kasih. Takzim,Negatif,hormat presiden joko widodo platform wni ijin usul patung yuri gagarin pasang mataram kebayoran jakarta mohon patung pindah ikn terima kasih takzim
@elisa_jkt @ikn_id investor mana yg mau perputaran duitnya sedikit karena orang yg ada dibatasi ke daerah situ.,Negatif,investor putar duit orang batas daerah situ
@V3g3L @ILCTalkshow Kenapa sih bapak itu ngotot ngga mau IKN? Dia dulling negara mana ya,Negatif,ngotot ikn dulling negara
@Leonita_Lestari Suruh aja Jokowi ttg Keppres IKN sebagai ibu kota selesai sudah. Krn secara UU sudah ditetapkan seperti itu. Kalau tdk ttg itu Keppres pelantikan Presiden di Jakarta berpotensi tdk sah.,Negatif,suruh jokowi keppres ikn kota selesai keppres lantik presiden jakarta potensi sah
@tempodotco Kapan pak bapak gak pernah ngajak kami makan-makan ke IKN yang bapak ajak influenza artis dan mentri-mentri bapak sekarang di ambang gagal baru bapak ajak kami kami tidak bersedia.,Negatif,ngajak makan makan ikn ajak influenza artis menteri menteri ambang gagal ajak sedia
@jackjackparrr @idextratime @bliblidotcom Ketawa IKN dah gua https://t.co/ncj6ozUHtA,Negatif,ketawa ikn
@txtdarialwy Loh kamu ga setuju ikn,Negatif,tuju ikn
@duplikatnyababe @elisa_jkt @ikn_id Eh tapi kata temen yang usaha catering buat pekerja disana. Pembangunan jalan terus loh. Sampe ada semboyan tiada hari tanpa ngecor,Positif,temen usaha catering kerja bangun jalan semboyan tiada ngecor
@Nofa_27R @ferrykoto @msaid_didu Maksudnya udah di dukung rakyat itu...IKN sudah di setujui DPR dan ada undang-undang....yg dimaksud rakyat disitu adalah DPR bukan perorangan kalo satu persatu rakyat Indonesia dimintain persetujuannya...sampe lebaran kuda,Negatif,maksud dukung rakyat ikn tuju dpr undang undang maksud rakyat situ dpr orang rakyat indonesia dimintain tuju lebaran kuda
Saya percaya bahwa pembangunan IKN akan jalan terus dan tidak mangkrak. Investor lokal dan asing sdh masuk dan kerjakan proyeknya masing². Hanya saja anggaran utk IKN utk th 2025 katanya cuma 154 milyar? semoga infonya salah dan bisa trs ngebut.. https://t.co/pYrdGFHFnQ,Positif,percaya bangun ikn jalan mangkrak investor lokal asing masuk kerja proyek anggar ikn milyar moga info salah ngebut
@princesstayuya @elisa_jkt @ikn_id Waktu aku mau daftarin mertua buat kunjungan kesana. Emang di aplikasinya rencananya mungkin akan berbayar Tapi gatau yaa. Pas kemarin mau daftarin muncul Rp. 0 gituuu Terus ada tempat kode voucher gatau buat apa https:/,Positif,daftarin mertua kunjung kesana aplikasi rencana bayar gatau pas kemarin daftarin muncul gituuu kode voucher gatau
@ilhamnoor90 @aniesbaswedan @denismalhotra @DokterTifa @JhonSitorus_18 @pandji @realfedinuril Hutang negara prestasi ya bayar pajak membeban buat masyarakat hukum di Indonesia ambu4 adur prestasi ya ikn bakal mngkrak prestasi ya eh mlah nyalahin rakyat ca,Negatif,hutang negara prestasi bayar pajak beban masyarakat hukum indonesia ambu adur prestasi ikn mngkrak prestasi mlah nyalahin rakyat
@Samudra_Biru90 @elisa_jkt @ikn_id Jangan2 mau dijadiin Jurassic Park resort?,Negatif,dijadiin jurassic park resort
@txtdarialwy Champions IKN,Positif,champions ikn
@TeddGus Bang kalo misalnya kelak ketika sudah dilantik Prabowo tidak berkantor di IKN itu gimana? Sementara belakangan pak Jokowi sudah memulai untuk berkantor disana,Positif,bang kelak lantik prabowo kantor ikn gimana jokowi kantor
@StefanAntonio__ @gibran_tweet @kaesangp Bisnis itu justru tempat cuci uang sama kaya IKN. Ga banyak yg paham,Negatif,bisnis cuci uang kaya ikn paham
Menurut gua sih cara mempermalukan Jokowawa ya dengan tidak melanjutkan IKN,Negatif,malu jokowawa ikn
@LambeResing Ini org memang tergila2 dgn simbolisasi. Peresmian penyerahan piala jalan di catwalk ikn sambil dadah2 show off kesederhanaan.... apayah..gaya politik bangke tebar pesona.,Negatif,orang gila simbol resmi serah piala jalan catwalk ikn dadah show off sederhana apayah gaya politik bangke tebar pesona
@BangPino__ @feriamsari Izin bertanya prof Dimanakah provinsi Daerah Khusus Ibukota Jakarta yang dimaksud oleh pasal 39 UU IKN karena menurut UU DKJ pasal 5 bahwa provinsi yang disebutkan diatas tersebut sudah 100% masuk ke dalam batas-batas wilayah Daera,Positif,izin prof provinsi daerah khusus ibukota jakarta maksud pasal ikn dkj pasal provinsi masuk batas batas wilayah daera
@DoankWarto Presiden Jokowi: Pembangunan IKN Nusantara Transformasi Menuju Indonesia Maju. IKN Nusantara akan menunjukkan kebesaran bangsa Indonesia dan mencerminkan identitas nasional. Indentitas apa akan nampak dikemudian hari?? https://t.co/16YcPBttyj.,Positif,presiden jokowi bangun ikn nusantara transformasi tuju indonesia maju ikn nusantara bangsa indonesia cermin identitas nasional indentitas nampak kemudi
@Lembayung071 Kalo ikn sekarang bukan ibukota ya gak berhak dapet anggaran dan kepala otorita yg berhak dapet anggaran itu kota yg resmi. aneh bener uu ikn sama dkj,Negatif,ikn ibukota hak dapet anggar kepala otorita hak dapet anggar kota resmi aneh bener ikn dkj
@ReflyHZ Izin tanya prof Dimanakah provinsi Daerah Khusus Ibukota Jakarta yang dimaksud oleh pasal 39 UU IKN karena menurut UU DKJ pasal 5 bahwa provinsi yang disebutkan diatas tersebut sudah 100% masuk ke dalam batas-batas wilayah Daerah Khusus Jakarta s,Negatif,izin prof provinsi daerah khusus ibukota jakarta maksud pasal ikn dkj pasal provinsi masuk batas batas wilayah daerah khusus jakarta
@elisa_jkt @ikn_id Kata gua apa. Semua proyek mulyono gak ada harga dirinya samsek. Buat postingan gini aja captionnya gak bangett sok asik tapi jatuhnya malah ngedown grade nilai itu,Negatif,proyek mulyono harga samsek postingan gin captionnya bangett sok asik jatuh ngedown grade nilai
@TeddGus Kalo ikn nusantara bukan ibukota ya gak berhak dapet anggaran dan ada kepala otorita. Aneh banget ini undang ² ikn sama dkj.,Negatif,ikn nusantara ibukota hak dapet anggar kepala otorita aneh undang ikn dkj
Ikn kepanjangannya ikentot,Negatif,ikn ikentot
Dimanakah provinsi Daerah Khusus Ibukota Jakarta yang dimaksud oleh pasal 39 UU IKN karena menurut UU DKJ pasal 5 bahwa provinsi yang disebutkan diatas tersebut sudah 100% masuk ke dalam batas-batas wilayah Daerah Khusus Jakarta sehingga menurut Undang Undang ini saat ini https://t.co/05pWEOBciF,Negatif,provinsi daerah khusus ibukota jakarta maksud pasal ikn dkj pasal provinsi masuk batas batas wilayah daerah khusus jakarta undang undang
@araawfn Ah katanya usogi ga suka kak ke ikn. Takut ketemu oknum titttt *disensor demi kenyamanan warga*.,Negatif,usogi suka kak ikn takut ketemu oknum titttt sensor nyaman warga
@LambeResing loh jarene ngantor nang IKN ancen paten lambene,Negatif,jarene ngantor nang ikn ancen paten lambene
IKN Pasti Mangkrak https://t.co/pkhTDDHcWl,Negatif,ikn mangkrak
Dis! Bahkan urusan pekerja tidak jadi kurikulum di SMK atau Perguruan Tinggi. Seolah output pendidikan kita: seorang layak jadi roda gigi industri. Tapi apa negara mau ngurusin hal ini? Enggak. Mending ngurus pembenaran IKN dan makan siang gratis. Buruh bodoh idaman negara.,Negatif,dis urus kerja kurikulum smk guru olah output didik orang layak roda gigi industri negara ngurusin mending ngurus ikn makan siang gratis buruh bodoh idam negara
Woii Mulyono udah sadar lu klo kekuasaan lu cuma sementara? Skrg udah mau lengser lu ngomong Rakyat yg mau IKN. Rakyat Indonesia juga udah paham itu awal mula IKN atas ambisi nya siapah! #adilijokowi https://t.co/DrJmolk9SF,Negatif,woii mulyono sadar kuasa lengser ngomong rakyat ikn rakyat indonesia paham ikn ambisi nya siapah adilijokowi
@Putri_Aalona @DPR_RI Kalo IKN itu apa..kok gak mirip garuda,Negatif,ikn garuda
@TeddGus Ibukota pindah TAPI BERTAHAP?.tanya yg bikin undang undang KEBLINGER atau habis MINUM KHAMR? Yakin IKN jadi? Insya Allah Tuhan itu maha SEGALANYA.,Negatif,ibukota pindah tahap bikin undang undang keblinger habis minum khamr ikn insya allah tuhan maha
@tempodotco Dipermudah dengan bangun IKN luasan nya setengah jakarta maksimal 3/4 jakarta fokus pada fungsi sebagai ibukota saja.. Dengan anggaran maksimal 150 triliun,Positif,mudah bangun ikn luas nya jakarta maksimal jakarta fokus fungsi ibukota anggar maksimal triliun
Ape nih??? Singgasana IKN cabang jepang?,Negatif,ape singgasana ikn cabang jepang
@tham878 Datang ke IKn juga sponsor Indonesia pake lagi duit rakyat Emang mereka g mikirin itu tanah disana itu jelek,Negatif,ikn sponsor indonesia pake duit rakyat mikirin tanah jelek
Bagus Sugiarta Harapkan Pemuda Kaltim Siap Bersaing di Era IKN - https://t.co/IMIjhchY07 https://t.co/8N9KlRK9u4,Positif,bagus sugiarta harap pemuda kaltim saing era ikn
Bosan dengan berita stategi marketing IKN seperti ini. Mereka berpikir membangun ibu kota negara sama dengan membangun sebuah kompleks perumahan.,Negatif,bosan berita stategi marketing ikn pikir bangun kota negara bangun buah kompleks rumah
Otorita IKN Klaim Progres Pembangunan Kompleks Istana Presiden Sudah 95 Persen https://t.co/oUR5fdxYH0,Positif,otorita ikn klaim progres bangun kompleks istana presiden persen
@KompasTV Arti dari korupsinitu apa ...? Klo ngerugiin negara doang wah banyak yg lain impor beras food estate kereta cepat ikn minyak dll. Wah kejagung salah sasaran nih.,Negatif,arti korupsinitu ngerugiin negara impor beras food estate kereta cepat ikn minyak jagung salah sasar
[News] Forum Bersama IKN (Forsa IKN) telah mengundang para blogger dan jurnalis independen untuk menyaksikan langsung perkembangan IKN. Ada yang diundang ?,Negatif,news forum ikn forsa ikn undang blogger jurnalis independen saksi langsung kembang ikn undang
@alisyarief Pindah dong lu ke IKN...buat rumah disono ..,Negatif,pindah ikn rumah sono
Kasus baru ?? IKN ya pak DPRRI.???,Negatif,ikn dprri
Pesanan. Kl mau proses hukum jgn pilih. Kl mau kerja serius ada dana haji ada food estate ada pembangunan infrastruktur yg bnyk itu tp ngak manfaat IKN dll msh bnyk lg kl serius berantas korupsi.,Negatif,pesan proses hukum pilih kerja serius dana haji food estate bangun infrastruktur ngak manfaat ikn serius berantas korupsi
@Metro_TV Ohhhh mo bahas IKN peninggalan Mulyono,Negatif,ohhhh bahas ikn tinggal mulyono
@alisyarief Forum bersama IKN. Wek wek wek...,Negatif,forum ikn wek wek wek
@PNS_Ababil Apakabar bangun IKN di tempat jin buang anak terus ga jd pindah lg.. itu rugi ratusan T harusnya di gantung sih,Negatif,apakabar bangun ikn jin buang anak pindah rugi ratus triliun gantung
@JhonSitorus_18 Yang bangun IKN rugiin negara ratusan trilyun harusnya digantung dong,Negatif,bangun ikn rugiin negara ratus trilyun gantung
@Tan_Mar3M Klo IKN negara untung apa rugi?,Negatif,ikn negara untung rugi
@AnKiiim_ Termasuk kalau IKN gagal mulyono juga harus ditahan sih!,Negatif,masuk ikn gagal mulyono tahan
@BosPurwa Dahlah usut aja itu IKN. Udah pasti ngerugiin masyarakat. Seret semua pejabat.,Negatif,dah usut ikn ngerugiin masyarakat seret jabat
@yowrneeds @Cilorconnoistre IKN yang terlupakan! Kasus nikel 300T denda 5rebu penjara 2th. Kasus gerombolan cina ngerampok emas Kalimantan dihukum ringan kasus tambang keluarga Cemara dll.,Negatif,ikn lupa nikel triliun denda rebu penjara gerombol cina ngerampok emas kalimantan hukum ringan tambang keluarga cemara
@AndreIrwanto92 @StefanAntonio__ Klu belum ke ikn ga perlu bacot. Ikn masih berlanjut tidak mangkrak,Positif,klu ikn bacot ikn mangkrak
@Heraloebss IKN nya mana dee..jngn pilih 2 ya dee,Negatif,ikn nya dee jngn pilih dee
@mfatahilahakbar IKN itu untungnya buat negara apa boleh dong diseidiki,Negatif,ikn untung negara diseidiki
@PartaiSocmed @36Dpib12339 @mohmahfudmd Kapan si Mulyono ditangkap Kejaksaan. Kasusnya lebih banyak IKN Mandalika Bandara Kertajati Woosh Disaat Negara tdk butuh itu semua si Mul memaksakan diri utk Import itu,Negatif,mulyono tangkap jaksa ikn mandalika bandara kertajati woosh negara butuh mul paksa import
@Otto_0967 Kapan ini orang ditangkap Kejaksaan Kasusnya lebih banyak IKN Mandalika Bandara Kertajati Woosh Disaat Negara tdk butuh itu semua si Mul memaksakan diri utk Import semua itu,Negatif,orang tangkap jaksa ikn mandalika bandara kertajati woosh negara butuh mul paksa import
@JhonSitorus_18 Padahal kalo penyebabnya kebijakannya merugikan negara food estate jelas merugi kereta cepat juga sudah dibilang rugi belum lagi IKN,Negatif,bijak rugi negara food estate rugi kereta cepat bilang rugi ikn
Prabowo Disebut Akan ke IKN Tahun Ini Resmikan Proyek Apa? https://t.co/C4QJfuGdUn,Negatif,prabowo ikn resmi proyek
Prabowo Khawatir Ada Perang Besar Swasembada Pangan Lebih Penting dari IKN https://t.co/snMptP2ZxV,Negatif,prabowo khawatir perang swasembada pangan ikn
@jahterra IKN potential lostnya berapa? Siapa yang harus digantung lehernya?,Negatif,ikn potential lostnya gantung leher
@M45Broo_ Bentar lagi ikn di audit..... Kasus tom lembong juga akan menjalar ke mulyono jika kejagung memang berani termasuk mentri mentri dan anak anaknya....... Semua tergantung prabowo.... Kecuali jika prabowo cuma presiden ayam sayur doang....,Negatif,bentar ikn audit tom lembong jalar mulyono jagung berani masuk menteri menteri anak anak gantung prabowo prabowo presiden ayam sayur
@Obay_Kusut1981 Aneh hanya karna kebijakan tampa menerima mafaatvdari kebujakannya bisa di pidana Kalau begitu tolong di tangkap yang buat kebijakan nembangun IKN itu juga k,Negatif,aneh karna bijak tampa terima mafaatvdari kebujakannya pidana tangkap bijak nembangun ikn
@Christi97025699 @jondhez IKN juga merugikan negara,Negatif,ikn rugi negara
@AnggaPutraF Bukit algoritma IKN Food estate ga mau sekalian diperiksa juga..? Barangkali di proyek² tersebut ada indikasi kerugian negara juga,Negatif,bukit algoritma ikn food estate periksa barangkali proyek indikasi rugi negara
BPK temukan masalah di proyek IKN Kaltim Kementerian PU dapat 51 rekomendasi https://t.co/VWtvTdwyX5,Negatif,bpk temu proyek ikn kaltim menteri rekomendasi
@AnggaPutraF IKN food estate kereta cepat Hambalang bandara kertajati pengelolaan dana haji dll,Negatif,ikn food estate kereta cepat hambalang bandara kertajati kelola dana haji
Prabowo: Sidang Paripurna 2028 Digelar di IKN https://t.co/XP5vBIyYTE,Positif,prabowo sidang paripurna gelar ikn
Perkembangan IKN makin HOT.... https://t.co/RXwIRm0ecP,Negatif,kembang ikn hot
@cakrozi @Heraloebss Klo kebijakan bisa dikriminalkan bagaimana soal kebijakan kereta cepat food estate ikn...?,Negatif,bijak kriminal bijak kereta cepat food estate ikn
@dhi_es_03 @Ngopisegersek @PartaiSocmed Oh iya..lalu gmn tuh kebijakn sial Keret Cepat IKN food estate ratusan trilyun lho itu iya trilyunan.....,Negatif,iya gmn kebijakn sial ret cepat ikn food estate ratus trilyun lho iya trilyunan
@DokterTifa Sepertinya Indonesia ini akan jadi dua negara dengan adanya IKN. Jadi jangan terkejut waktu nanti kita akan dihadapkan pada kenyataan ini. Indonesia barat dan Indonesia Timur. Di Timur kekuasaan turunan jokowao. Ini analisa sepertinya orang li,Negatif,indonesia negara ikn kejut hadap nyata indonesia barat indonesia timur timur kuasa turun jokowao analisa orang
icara soal IKN Menko AHY: Proyek Dilanjutkan Namun Ada Penyesuaian. PDemokrat AgusYudhoyono Demokrat Bersama Rakyat https://t.co/Stk64w0w47,Positif,icara ikn menko ahy proyek sesuai pdemokrat agusyudhoyono demokrat rakyat
Bicara soal IKN Menko AHY: Proyek Dilanjutkan Namun Ada Penyesuaian. AgusYudhoyono PDemokrat Demokrat Bersama Rakyat https://t.co/PwiXUWNyNo,Positif,bicara ikn menko ahy proyek sesuai agusyudhoyono pdemokrat demokrat rakyat
Jokowi Terima Kunjungan Forum Bersama IKN di Solo Tegaskan Komitmen Kolaborasi Pembangunan IKN https://t.co/QjCHLZldlK,Positif,jokowi terima kunjung forum ikn solo komitmen kolaborasi bangun ikn
@Kartika4567 @Twt_dr_je @erasmus70 IKN proses administrasinya yg belum lengkap bedakan dengan melanggar aturan. Lagian IKN itu kebijakan dan ada UU nya.,Positif,ikn proses administrasi lengkap beda langgar atur ikn bijak nya
@liaasister Lebih milih bangun IKN daripada ngasih gaji besar buat para guru... Biaya pendidikan mahal gaji guru kecil gimana negara mau maju kayanya lebih senang klo rakyat nya bodoh jadi biar bisa di bodohi sama pejabat nya.,Negatif,milih bangun ikn ngasih gaji guru biaya didik mahal gaji guru gimana negara maju kaya senang rakyat nya bodoh biar bodoh jabat nya
@B_dzoel Tembak kepala Potong leher Gantung di IKN,Negatif,tembak kepala potong leher gantung ikn
@xquitavee @gibran_tweet segera pindah ke IKN bapakmu sdh bikin istana,Negatif,pindah ikn bikin istana
@kuantumsteve Bukan. Korupsi itu artinya memperkaya diri sendiri. Merugikan negara ya KCIC dan IKN apa untung? Bagi bagi sembako gratis apa negara untung? Ini negara bukan perusahaan swasta. Bahkan dalam dunia usaha rugi pun bukan kejahatan. Kalau mau kel,Negatif,korupsi arti kaya rugi negara kcic ikn untung sembako gratis negara untung negara usaha swasta dunia usaha rugi jahat kel
@AndreIrwanto92 @StefanAntonio__ Goblok goblok sejak kapan IKN mangkrak. Ini para pembenci doa nya IKN harus mangkrak. Sakit hati boleh tapi jangan goblok.,Positif,goblok goblok ikn mangkrak benci doa nya ikn mangkrak sakit hati goblok
Beneran nih IKN sebagai kantor gubernur kelak...! @jokowi,Negatif,beneran ikn kantor gubernur kelak
@kompascom Jangan lupa telisik IKN ada tidak mafia tanahnya?,Negatif,lupa tisik ikn mafia tanah
@ferrykoto kalo bener TL korupsi tangkap aja. IKN tuh potensi loss nya lebih besar sejuta kali lipat tapi kok gada diusut? loss nya food estate ribuan kali lebih besar tapi kok aman aj? kalo ada aliran dana ke TL harus ditangkap. tapi kalo kasusnya karena,Negatif,bener korupsi tangkap ikn potensi loss nya juta kali lipat gada usut loss nya food estate ribu kali aman alir dana tangkap
