detokenize_text,sentimen
orang hobbyne ngutang utang numpuk jga maksain bangun ikn,Negatif
doa ikn gimana wkwk,Negatif
dukung bangun ikn,Positif
milu menteri investasi kebut cari investor dana ikn,Negatif
ikn bangga lapang upacara standar fifa ibukotanegara iknnusantara pindahibukota,Positif
ikn bangga lapang upacara standar fifa ibukotanegara iknnusantara pindahibukota,Positif
rakyat gocek pinjol biyuemen gocek china trap elah proyek ngapain bangun ikn duit,Negatif
china imbal tol ikn sawah padi,Negatif
ikn,Positif
catat dosen unair relokasi asn ikn bijak buru buru tempotekno,Negatif
fix siluman kaltim menang pragib arti kaltim siluman kaya hutan gundulin tambang ikn haha,Negatif
ahy kasih tugas ikn gusur rakyat pindah,Negatif
bang djan etis kadi anggota paskibraka ikn wkwkwkwkw,Negatif
beda proyek ikn beban perintah berat byr utang hambat utama utang bayar utang prediksi praroro kondisi indonesia nyata,Negatif
singaporean companies investing ikn,Positif
ikn panas bro mending kerja jawa deh,Negatif
indo kalah gara wasit china ngadu lord luhut batalin proyek kerjasama china masuk kreta cepat nikel toll ikn,Negatif
indo kalah gara wasit china ngadu lord luhut batalin proyek kerjasama china masuk kreta cepat nikel toll ikn,Negatif
indo kalah gara wasit china ngadu lord luhut batalin proyek kerjasama china masuk kreta cepat nikel toll ikn,Negatif
kalbar ikn jauhh,Negatif
sukanto tanoto lahan investasi ikn initip gurita bisnis,Positif
status kota jakarta cabut jokowi pusat perintah pindah ikn nusantara,Positif
bang buka data milik konsesi lahan ikn tukar guling buka rincian anggar kemenhan personil militer alutsista indonesia tekh,Negatif
kalu lihat ikn lahan masuk properti milik orang swasta,Negatif
polri kirim personel ikn breaking news,Positif
polri pindah personel tugas kota negara ikn tahap langkah laku,Positif
jokowi singapura dukung bangun plts ikn,Positif
rekrutmen asn fresh graduate ikn buka,Positif
dukung hadap ikn masyarakat indonesia milik semangat tekad kuat maju indonesia,Positif
ikn,Negatif
polri pindah personel ikn,Positif
sedia area aktivitas demo ikn hyde park london demo ganggu traffic speaker megaphone situ larang bikin polusi suara kuat pita suara leher,Positif
balikpapan ksi orang kalimantan mesti kaltim bandara internasional numpuk bpp ikn lumayan deket,Positif
akses pontianak ikn sulit pontianak kuching,Negatif
bangun ikn prioritas utama anggar,Negatif
tandain muka nya tau nguli proyek ikn tonjok muka nya,Negatif
wowo srh tlp xin ping ikn batal,Negatif
bahlil jokowi bentuk tim cepat investasi ikn,Positif
nobar timnas kutaitimur affu support garuda muda puluh ribu masyarakat sangatta tumpah ruah dukung timnas aff shintaeyong bupati kaltim ikn nusantara,Positif
ngantor ikn demo patung kuda jakarta kehi angan vibe nya organizer demo fee komponen biaya transport jakarta ikn solusi rekrut kaltim ikn perintah sedia spot khusus,Negatif
hidup cina hidup ikn,Negatif
polisi telusur penyalahgunaan narkoba kerja ikn,Negatif
nyata lihat pinggir jalan proyek bangun jalan bebas hambat seksi instagram mitraikn facebook mitra ikn tiktok mitra ikn youtube mitra ikn mitra ikn fyp mitraikn jalanmenujuikn jalanbebashambatan malu ikn ikn,Positif
personel polri pindah ikn tahap pemindahanpersonelpolri ikn polri humaspolri trunoyudowisnuandiko,Positif
rezim mikir rakyat susah beli butuh mikirin duduk raja singgasana keluarga kuasa indonesia gedung cakar langit asia bangun ikn nusantara,Negatif
iya yaudah jadiin tumbal proyek ikn plzzz,Negatif
suasana nobar kantin huni kerja konstruksi hpk ikn,Positif
jokowi nelfun presiden uzbek biar ngalah ntar kompensasi kasih invest saham ikn uzbek ngeri liat wkwkwkwkwk,Negatif
presiden jokowi teken undang undang kait provinsi daerah khusus jakarta dkj april status kota indonesia sandang jakarta kota nusantara ikn letak najam pasir utara provinsi,Positif
upacara adat khas kaltim tradisi penuh makna ikn,Positif
indonesia prioritizes local investors ikn says mister bahlil tempoenglish,Positif
pantes jabat enggan ikn,Negatif
huuu nawarin kota tara ikn,Negatif
ikn susah air listrik,Negatif
love jokowi love jokowi love jokowi please continue ikn long live prabowo gibran love pragib salam pancasila,Positif
ikn kaltim kak kaltara bandara internasional,Negatif
ikn bangsat bener jokowi anjing,Negatif
ikn jalan tuju bundar kota nusantara april,Positif
ikn bangun bandara internasional,Positif
polri kawal ikn pindah personel,Positif
lihat ikn bangun konglomerat,Negatif
masuk list ikn mew awowkwowkk plot twist,Negatif
rumah ikn full furnished tips jitu menteri usia muda brb wawancara nadiem makarim,Negatif
putar vedeo ahy tebtang ikn,Negatif
alda mending cpns biar dapet rumah ikn jomblo bonus pasang,Negatif
batal ikn dukung pranowo,Negatif
akademisi balikpapan sisi gelap ikn konflik tanah adang masyarakat kaltim,Negatif
ikn sihh konser ikn wkwkwkwkkw biarr boncos woiii,Positif
bahlil lahan khusus sukanto tanoto investasi ikn,Positif
pns pindah ikn jaya herbud,Positif
ikn terap sistem transportasi cerdas,Positif
ikn terap sistem transportasi cerdas,Positif
ikn bangun presiden jokowi bangun kota metropolitan modern shenzhen china afcu asiancup timnas day nobar piala asia undip olimpiade paris rcti innalillahi jakarta,Positif
kang emil jokowi gelar upacara merdeka agustus ikn nusantara afcu asiancup timnas day nobar piala asia undip olimpiade paris rcti innalillahi jakarta,Positif
bahlil lahan khusus sukanto tanoto investasi ikn,Positif
ria masyarakat ikn,Negatif
gila ikn,Negatif
kait karo ikn,Negatif
deket ikn,Positif
alhamdulillah hermina bangun ikn salah fokus jaga gan,Positif
presiden jokowi lee bahas investasi ikn,Positif
bandara harga ikn,Positif
jokowi tim cepat investasi ikn,Positif
kerja regu rombong enak rombong menang pilpres rombong garap psn masuk ikn rombong sumbang tonton rakyat rombong kasih makan gratis,Negatif
ikn pajakin,Negatif
bahlil lahan konglomerat sukanto tanoto ikn,Positif
fer dasar mulus ikn masuk lumpur hidup,Negatif
temu laku rangka leader retreat indonesia singapura temu bahas isu tahan tahan pangan teknologi transisi energi bangun kota nusantara ikn,Positif
alhamdulillah bahlil lahan konglomerat sukanto tanoto ikn,Positif
patungan bangun ikn,Negatif
padat nya kerja konstruksi arah ikn nusantara slot terbang arah balikpapan,Positif
temu presiden jokowi lee bahas implementasi janji fir investasi ikn,Positif
ikn biar kak daerah khusus ibukota,Positif
kebut bangun investasi ikn milu progres juli agustus nginep kemarin panggil presiden kepala ikn bahas khusus bahlil ikn,Positif
bahlil tim cepat investasi ikn,Positif
siasat perintah bentuk tim investasi dorong bangun ikn nusantara,Positif
point tuju mahfud masuk usia sisa potong beli rumah modus perintah biaya bangun ikn bayar utang,Negatif
ahmad dol kurnia kagum desain pusat perintah provinsi papua saing ikn airlanggahartarto kuningkeren prabowogibran partaigolkar golkarpedia,Positif
thn pimpin colong triliun korupsi nya ngeri jaman perintah sby berkat buzzer nya smua kamuflase seoalah pimpin simbol korupsi sby hambalang prestisius ikn ngeri,Negatif
makan ikn,Negatif
samar mahfud tutup biaya bangun ikn initapera tahta kuasa rakyat,Negatif
kawasan inti wilayah ikn bebas sepeda motor motor kendara aman kendara bunuh kendara tertib kendara langgar lalulintas ikn cth kota modern bebas kendara sepeda motor,Positif
proyek ikn mahal boss,Positif
hitung data kemenaker jmlh tenaga kerja indo gaji bln ptongan tapera bln perintah dana masuk triliun bln triliun thn dana segar putar ikn,Negatif
gorong gorong jahanam muara ikn sial,Negatif
enak tua jamin ikn,Negatif
tapera bangun rmh ikn,Positif
data kemenaker jmlh tenaga kerja indo gaji bln ptongan tapera bln perintah dana kelola masuk triliun bln triliun thn dana segar putar makan siang gratis ikn,Negatif
layar kesan maju neg paralel peduli lingk etalase nama ikn basis buah neg pokokemaju next mbuh,Negatif
kereeennn ikn,Positif
data kemenaker jmlh tenaga kerja indo gaji bln ptongan tapera bln perintah dana kelola masuk triliun bln triliun thn dana segar putar makan siang gratis ikn,Negatif
dukung ikn,Positif
konten pornografi judi online blokir ikn kaltim via internet starlink ikn kaltim starlink,Positif
korup lunasin ikn,Negatif
biaya bangun ikn sejahtera jabat segitu bangun ikn,Negatif
ikn masuk publik kudu,Negatif
inovasi ikn nusantara taksi terbang hyundai balikpapan uji coba ibukotanegara iknnusantara pindahibukota,Positif
bangun mangkraak lihat bandara gedung ikn sebentar,Negatif
harga barang murah cengeng subaidi mandiri harga sembako listrik bbm ukt gaji jabat turun umr bangun ikn kereta cepat nkri harga mati,Positif
kereta bandara ikn target rampung stasiun bangun gin anggar,Positif
bikin ikn ngutang nguras apbn,Negatif
prediksi anak gara case gibran kemaren kaesang proyeksi mayor nya ikn wkwkwwk,Negatif
profit mas usaha negara peran tuan tanah papua proyek ikn eco rempang bandara internasional jawa barat proses gusur tanah ulayat hasil masyarakat adat cemas mik,Negatif
suruh patungan bangun ikn rakyat,Negatif
oke gas ppn makan siang gratis ikn tapera jiwasraya jilid,Positif
otorita kota nusantara oikn bangun kereta hubung bandara pinggan balikpapan ikn target selesai konstruksi kereta regional target,Positif
mahfud tuju nya rumah rakyat iming iming tuju sungguh jokowi khawatir ikn bengkalai sedia uang pakai pembanhunan ikn uang triliun,Negatif
ikn invest pake duit rakyat kedok tapera tunjang biaya hotel pesawat rangin brengsek kelen,Negatif
bikin ikn,Negatif
menteri tapera rumah ikn mahal,Negatif
pindah ikn kalimantan antisipasi potensi bencana bancana,Positif
duit ikn ratus triliun murahin ukt gratis,Negatif
keren warga ikn taksi terbang mobilitas kota,Positif
perintah jujur bilang duit tapera bayar ikn hutang negara jth tempo rakyat dudukin dpr,Negatif
ikn dana,Negatif
temen macem smi pegang proyek ikn anak perintah gpp komentar perintah pedes karna nyata hehehehehehe,Negatif
tarik anak presiden ponakan presiden tarik jakarta ibukota negara nasib ikn nyata gula jakarta,Negatif
tinjau proyek ikn,Positif
hehe narasi iso hehe anak lulus sma didik min sma presiden bukti kkn smkin subur ikn betah,Negatif
lha enak bner bangun ikn ajiing jokodok suruh tnggungb ajeen,Negatif
bagus hasil korupsi koruptor pakai bangun ikn sita jual aset orang kirim palestina indonesia orang,Negatif
moga project kemenpupr bangun ikn allah ikan lancar bpk jalan utama kelok kelok kontur tanah lurus lurus simetris washington abai konsep forest city,Negatif
kembang ikn larang kawasan via com iknkotamodern ikn indonesiaemas indonesia,Positif
menteri agama begok uang umat bangun ikn,Negatif
yessss sunti ikn,Negatif
beda statement bantu lurah bilang butuh uang bangun istana tinggal jokowi nama ikn die hardnya nyumbang,Negatif
sumpah mumet lihat negara regulasi ubah gebrak berita ikn nabrak konstitusi tapera ngubah umur ubah taiiiii,Negatif
yauda ngasih anak muda track record nya aman bismillah rumah ikn tunjang umur hidup,Positif
bungsu menang pilgub jakarta ikn pindah liat hahaha atur sulap ketua dprnya bodoh,Negatif
panglima pajaji dayak tolak ikn,Negatif
feeling jabat negara rencana kaya publik sengaja kasih isu kontroversial ukt tapera siar biar bingung analogi sembunyi daun hutan isu korupsi triliun disembunyiin ikn ngerti,Negatif
bayar bunga hutang bangun ikn,Negatif
susah bilang inflasi gagal ekonomi adaaa bahasa pakai njelimet indo harga jdi serba mahal karna dana alih proyek ikn usa karna dana setor israel,Negatif
ikn kali wkwkw,Negatif
gampang pajak usaha jabat beuh ikn beverly hills,Negatif
ngomong rezim ikhlas uang haji biaya ikn,Negatif
kedok joki duit ikn,Negatif
sukarela bayar main potong dik cebong sukarela dana haji pakai bangun ikn tanggung korupsi,Negatif
akwokowkeo bagus rumah tapera banding rumah menteri ikn,Negatif
iya uang ubah gedung infrastruktur ikn rakyat butuh ikn bangun ikn parah rakyat peras modalin bangun ikn hapus subsidi bbm,Negatif
kumpul itumahhhh kaya tabung rumah gausah sok ngide anjing butuh duit bkin ikn sok bikin bijak najisss info negara visa gampang,Negatif
suruh nabung mah puter duit bikin ikn makan gizi gratis,Negatif
bisaaa rotate crane nya jalur heran pusat perintah pindah ikn ngapain bikin gedung,Negatif
bilang butuh dana segar sokong proyek ikn,Negatif
iya butuh bangun ikn,Negatif
bangun ikn pake apebe emangnye bangun pos ronda pake apeaje mangkenye comot pertanggungjwbnnye ade ade aje netizen konohe xixixi,Negatif
salah ngusulin atur tolak wapres budiono jaman sby koq laku tuju untung rakyat mekanisme gmn bayar ikn tanah wowo,Negatif
bangun ikn audit nya biaya out,Negatif
antek perintah lihat megah rumah ikn,Negatif
nya cari dana ikn nya mahasiswa tpi mkanya alihin rakyat gaji jenius kau jok duit trkmpul hya tapera gol,Negatif
arti jual aset tanah bangun milik negara kantor tri aset jual murah taipan jakarta sulap pusat bisnis ala shenzen gibran teken kaesang ngawal proses hasil jual,Negatif
viralin hakim pungli polisi korup peras layan publik ikn najam tag akun suara dengar,Negatif
dana haji korupsi urusin uang rakyat duit bangun ikn maksain,Negatif
tapera mudah rezim kumpul dana ikn,Negatif
muncul ikn naskah akademik uunya kilat batas wilayah milik lahan sengketa cengang,Negatif
cooookkkk gatel seng karep bangun ikn sopo cokkk sak negoro seng kon bayar,Negatif
ikn ikn,Negatif
bangun rumah menteri ikn,Negatif
bangun ikn langkah tuju transformasi indonesia dukung wujud impi all eyes rafah ginting nabila kaesang tiktok,Positif
ikn pindah kota harap maju bangsa ayo dukung bangun ikn cerah all eyes rafah ginting nabila kaesang tiktok,Positif
bunga mah niat ngerampok duit kelas duit puter dibeliin surat utang negara biar ngutang bangun ikn,Negatif
bicara ikn sema uinsi samarinda harap kritis mahasiswa bangun iknkotamodern,Negatif
kumpulin korup ngebangun ikn,Negatif
dinaikin target ikn mukbang gratis realisasi coba kasih asumsi nya asumsi,Negatif
naif prabowo menang nya erat kait ikn mukbang gratis pasca covid ekonomi negara butuh,Negatif
lihat nyata menteri boneka tolol ketua mempertanghung pimpin kocak bas kagak isi bangun tol ikn andil tim menteri,Negatif
ikn,Negatif
ikn mas mba,Negatif
tabung ikn mbah uang gagal ilang,Negatif
perintah konoha fungsi paylater pinjam perintah rakyat potong kumpul lumayan modal pasar saham biar ikn nya,Negatif
isi tapera kaesang ikn biduan yasin limpo gaji nya gakerja anjjjj muak bangett negri kacaw balaw ken nonton haikyuu bioskop dnd pulang nya makan indomie dobel kaleng,Negatif
rute taksi terbang ikn kaltim balikpapan palu uji coba samarinda tribun kaltim,Positif
perintah konoha fungsi paylater pinjam perintah rakyat potong kumpul lumayan modal pasar saham biar ikn nya,Negatif
coba cek anggar tahan eta rapat rapat dpr deh ngomongin pajak ikn hehehehe,Negatif
jabat jabat kotor baju bersih tangan bersih wangi bacot melibihi tuhan ketemu biden ngapain sodara main barat diem mentingin ekonomi bobrok tapera dana talang ikn,Negatif
nalar pakai dikit napa nyebrang sungai buaya nyebrang joko brani bikin atur ikn makan siang gratis byrin hutang,Negatif
wajib ngejar bangun ikn keburu teruain siaanya korupsi,Negatif
platform bukti nyata komitmen ikn nusantara hadap lingkung,Positif
percaya tipu daya rakyat tapera butuh bangun ikn,Negatif
seremoni zikir prosesi pindah kota jakarta ikn,Positif
ahmad dol kurnia kagum desain pusat perintah provinsi papua saing ikn golkarindonesia airlanggahartarto partaigolkar golkaronsosmed golkarpedia kuningkeren ahmaddolikurnia,Positif
jalur laut bang jam ikn bang sulawesi,Positif
bujuk sengkuni koq podo manut lok ngerasakno keringet netes laah sik enake maen potong lok ngerasakno urip nang ikn koq peres bayar utang ancene nek sengkuni sengkuni,Negatif
insyaalloh cucu kepala otorita ikn upacara agustus rubah atur syarat nya anak kakek nya jabat presiden,Negatif
simpan benci rezim jokowi dinasti influencer ngendorse ikn ibukota ramah lingkung kena gimmick anjing ngentot kaga daerah bwh ikn bangun skg pas kemarau susah air pas ujan banjir bangsat,Negatif
bawa duit bangun ikn,Negatif
menteri sibuk ngurus ikn tol bendung gga ngurus rumah rakyat,Negatif
pawangg ulerrr rusun ikn gaji haha,Negatif
kom dirut pln isi ikn listrik hijau plts megawatt transisi energi konsep bangun infrastruktur listrik ikn smart green and beautiful,Positif
mah akal bwt modal bangun ikn wkwkwk investor cabut,Negatif
rumah beli nunggu pensiun sangon jamin tua potong bingung nyari alas bilang negara bokek dana ikn negara easy money,Negatif
huhuhu takut ikn,Negatif
bangun ikn bangg negara duit deh tarolah iur orang juta kerja triliyun gedee hahahaha giur demografi indonesia suruh patungan kitaa,Negatif
sumber nya usul tapera kapitalis jabat dibandingin eropa bijak jujur munafik ambil bunga ntah nalangin ikn utang contoh bpjs layan sulit dipe,Negatif
ngapain kaesang rebut dki knpa jdi pnguasa ikn ssah bngun tpi dkasih orang suruh ngurus dtmpt nyaman gibran pmegang otorita jabodetabek kaesang pnguasa dki,Negatif
perintah tarik bikin ikn taksi terbang kayak,Negatif
sofie nolak ikn,Negatif
lola perintah ikn konstitusi pindahibukota,Negatif
rumah gausah usik uang rakyat pindah ikn pake gaji motong gaji rakyat,Negatif
mah bangun ikn lucu,Negatif
prosesi pindah kota jakarta ikn agustus,Positif
mbangunan ikn lancar mudah selesai adab,Positif
prabowo keras moga sadar ikn delusi jokowi,Negatif
tanah ikn yng fasilitas nya serba unggul ternak tan suka hati ngawasin bangun ikn,Negatif
bikin ikn bikin istansla anggar makan gratis lindung rakyat ngaco,Negatif
nasihat bijak politis demokrat dino patti djalal bangun ikn beliau mantan dubes new york mantan wamen menlu mantan jubir presiden sby,Negatif
ikn,Negatif
menteri bumn apresiasi gerak cepat pln hadir energi bersih ikn,Positif
buatin ikn cari biar liat hiruk pikuk ramai pansion,Negatif
steve bahas kmren kagak duit bangun ikn ikn bangun infrastruktur kagak dukung konsultan nya resin iknnya bandara,Negatif
bangun rumah ikn,Negatif
ikn tampil punggung kantor presiden selesai pasang,Positif
ikn kaltim habis dana apbn triliun alas investor asing masuk,Negatif
ikn kalimantan ngantornya jakarte,Negatif
gorong ikn progres,Negatif
knapa ngebet jakarta provinsi ikn,Negatif
dukung bangun ikn,Positif
ikn kereta cepat dinasti politik,Negatif
jokowi pindah ikn via,Positif
dukung bangun ikn,Positif
ikn nusantara,Positif
sebentar lapang ikn insya allah,Positif
ayo asn ber lomba pindah ikn khusus asn demam esemka promosi jabat rugi damping puja,Positif
level jabat suruh panas upacara ikn vibesnya cisauk versi panas bara wkwk,Negatif
pakai alas ngeles bohong pake apbn ikn nyantai bohong pake apbn kereta cepat bangga bikin bohong mobil smk bohong sego,Negatif
salah rakyat perintah kes ikn korban,Negatif
ikn,Positif
ikn,Negatif
satpam teebang satpam ikn,Negatif
promosi fasilitas asn pindah ikn temponasional,Positif
presiden joko widodo jokowi kantor kota nusantara ikn kalimantan timur juli,Positif
apbn nya tekor ikn byr utang,Negatif
dampak ikn,Negatif
direktur eksekutif segara research institute piter abdullah investor investasi ikn ibukotanegaranusantara iknnusantara indonesiaemas iknkotamodern ikn indonesiamaju smartdefensesystem,Positif
direktur eksekutif segara research institute piter abdullah investor investasi ikn ibukotanegaranusantara iknnusantara indonesiaemas iknkotamodern ikn indonesiamaju smartdefensesystem,Positif
direktur eksekutif segara research institute piter abdullah investor investasi ikn ibukotanegaranusantara iknnusantara indonesiaemas iknkotamodern ikn indonesiamaju smartdefensesystem,Positif
direktur eksekutif segara research institute piter abdullah investor investasi ikn ibukotanegaranusantara iknnusantara indonesiaemas iknkotamodern ikn indonesiamaju smartdefensesystem,Positif
jokowi selesai beliau bangun infrastruktur sabang merauke laku hilir bangun ikn proyek strategis nasional dlsbg salam lowbatt losers,Negatif
website kip kena serang cyber anjir kek ikn,Negatif
bohemian grove masuk ikn,Negatif
ikn kota bangga,Negatif
anjing bilang ikn kaya cisauk wkwkwkwkwkwkwkwkwkwkwkwk,Negatif
ikn kaya cisauk,Negatif
data nasional hilang ngapain ikn,Negatif
monggo tunggu yehhh fyi alhamdulillah ikn hujan deras pagi hawane sejuk ehh triliun banjir triliun info genang miliar,Negatif
mantap jokowi biar hutan ikn abah anies urus jakarta biar ganggu program kerja nya maju kota bahagia warga,Negatif
maksud anggar gerus ikn,Negatif
rencana ikn,Negatif
gibran ikn bagus manfaat,Negatif
penasaran ikn tumbal proyek,Negatif
bangun ikn audit bangun kereta cepat audit karna biaya lumrah bengkak,Negatif
ringgal ikn lha lho,Negatif
minggu indonesia juni indonesia emas ikn bumn jakarta reformasi selesai shp pin merah putih stamps postoffice philately ebay nft art propertyinvestment miliar reformasi asembagus situbondo tapal kuda jawa timur mandalika komodo,Negatif
emamg ide bandara ikn tinggal kabur dahh,Negatif
bangga ketua wakil ketua ikn undur hormat moga jejak jabat kerja,Negatif
numpang makan ikn lapar,Negatif
jokowi bangun rumah karanganyar jawa ikn contoh bangun rumah tinggal ikn,Negatif
masyarakat dukung bangun ikn tni angkat darat kodam mlw tniprima profesional responsif integratif modern adaptif tniadmengabdidanmembangunbersamarakyat tentararakyat infokomando tniad korem asn korem bersamarakyattnikuat prajuritmulawarman,Positif
jokowi mah ambil enak tinggal ongkang angking lepas tangan ikn likely bodo,Negatif
ikn pindah kalimantan anggap khianat apalgi pindah kabupaten karimun propinsi pulau riau,Negatif
kantor ikn bangun rumah colomadu karanganyar jawa citra contoh bangun rumah ikn,Negatif
jokowi tanah pindah ikn lengser solo,Negatif
focus makmur negri sejahtera rakyat dar paksa ngantor ikn boros anggar timbang,Negatif
menteri bumn apresiasi gerak cepat pln hadir energi bersih ikn,Positif
ikn daerah ekuator panas sengat kelembaban konsep kota hutan bangun ramah lingkung sumber air bersih batas kelola biaya murah calon hun disiplin triliun,Negatif
ikn bancak jamaah anggar mang serius ibukota enelan haha,Negatif
bangun ikn bangun kereta cepat kaya nyata riba,Negatif
lonte ngomong sibuk congor luh ngusik anies hina hidup luh kerja halal makan urusin noh ikn banjir polisi ngeroyok bocil harga sembako judi online,Negatif
jokowi ikn menteri,Positif
lurah ikn wokeowkwoko,Negatif
ikn progres bangun istana negara burung garuda memorial,Positif
sampah kawasan ikn olah tpst kapasitas ton agustus tribun kaltim,Positif
menteri becus enak rumah ikn ribu meter menteri warga nya boro dihhh lakuin pasrah lakuin tindak solutif ken preventif nya coy buka mata looo tuju twitnya mba nana,Negatif
marah sesuai cocot tinggal ikn ngapain pulau jawa,Negatif
halooo triliun kantong halooo mobil indigo esemka halooo juta investor ikn negeri halooo stop impor pangan gorong gorong gorong gorong,Negatif
musabab msf kelas kepsek besok guru pelosok dieksport ikn jdi guru tuju,Positif
ikn mangkrak buru cetus ide nya layak buru binatang liar hutan tangkap kulit,Negatif
wilayah ikn,Negatif
curiga sengaja retas tar duit nya ikn,Negatif
boyong jajar bumn tinjau ikn erick thohir kesiap fasilitas upacara agustus nusantara tempobisnis,Positif
rakyat ngapain ikn,Negatif
kaya food estate ntuh food kemane kayu hutannye kaya ikn kota jamaah guyuramnye haha,Negatif
jokowi kantor ikn juli bangun istana presiden persen tempobisnis,Positif
masuk rencana ikn gan hehehe,Negatif
ngapain cape bangun ikn pilih rumah hadiah rakyat pulau jawa duduk ikn naturalisasi singapura nama pukimak,Negatif
inget ikn inget vegas mafia,Negatif
gelar puncak raya hut ikn ampi undang ketua golkar airlangga hartarto,Positif
lokasi rumah presiden ikn bangun,Negatif
prabowo jokowi tinggal ikn pensiun jokowi pilih tinggal solo dng tanah rumah negara super luas,Negatif
ikn,Negatif
menteri bumn apresiasi gerak cepat pln hadir energi bersih ikn,Positif
audit ketua projo bilang anggar anggar ikn,Negatif
bang ntar jual bayar ikn,Negatif
ikn jalan tenggelam pks halang ikn indonesia rusuh sepeeti afrika suriah,Negatif
marah kagak hak rumah mantan presiden netizen rumah lokasi ikn anggap percaya prospek ikn,Negatif
pdn ikn nya ngawur,Negatif
hoax peristiwa banjir nyata jarak kilometer ikn,Positif
indonesia hadap bonus demografi ikn,Positif
otorita ikn pedoman reklamasi lahan tambang nusantara,Positif
bpn kawal proses ganti untung hektare lahan ikn,Positif
coba uang bangun jalan raya jalan tol yah jalan raya orang pake muter masuk rakyat,Negatif
wujud forest city ribu hektare lahan ikn direforestasi,Positif
jago kalah kalah mah kalah tar jokowi ikn loe bikin isua jabat ngebet jabat tinggal ikn baca keman arah nya tolol,Negatif
telkom bantu startup kontribusi kembang ikn,Positif
ikn bilang udara bersih milir tenang bagus rumah mantan presiden ikn,Positif
radio republik indonesia pindah asn ikn,Positif
rakyat jelantah ikn mbrangkang,Negatif
wapresnya ikn istana,Positif
polri bnpt aman upacara merdeka ikn,Positif
istana presiden huni asn ikn juli,Positif
perintah komitmen penuh hak masyarakat dampak ikn,Positif
ikn mantap,Positif
ikn,Positif
suka dinasti dajjal serah doa kubur sesal oya moga ikn mangkrak moga cepat rusak hancur,Negatif
gede ikn ntar bilang presiden sengaja ambil duluan tanah gede biar ntar triliun goreng,Negatif
nolak ikn nolak tol nolak alutsista mundur,Positif
dukung anies pandji suka dinasti bikin jokowi prabowonya pandji lho pro ikn makan siang gratis,Positif
widih warga ikn,Positif
bang takut langsung mutasi ikn,Negatif
lupa sohib konsorsium ikn merdekaaaaaa,Positif
menteri bumn apresiasi gerak cepat pln hadir energi bersih ikn,Positif
lurah ikn,Negatif
dasar otak kerdil tar rumah ikn loe goreng isu jabat ngebet kuasa ato wakil jokowi ato mas gibran dasar pasu,Negatif
kembang tol ikn sipepek nonton innalillahi wkwk tolol clash champions bandung nyetrika,Negatif
urgent ikn mah samping kerja rakyat babu bos sok mikir,Negatif
majelis rakyat papua dukung bangun ikn sipepek nonton innalillahi wkwk tolol clash champions bandung nyetrika,Positif
